,Name,Publications,Publication ID,Num Citations,Citation Links,Date
108,Tim H. Murphy,Histochemical detection of quinone reductase activity in situ using LY 83583 reduction and oxidation,qJjM8hkAAAAJ:4JMBOYKVnBMC,36,https://scholar.google.com/scholar?oi=bibs&hl=en&cites=5931376229185026716,1998
109,Tim H. Murphy,Podocalyxin is required for maintaining blood–brain barrier function during acute inflammation,qJjM8hkAAAAJ:k8Z6L05lTy4C,35,https://scholar.google.com/scholar?oi=bibs&hl=en&cites=17572510857803510960,2019
110,Tim H. Murphy,Ministrokes in channelrhodopsin-2 transgenic mice reveal widespread deficits in motor output despite maintenance of cortical neuronal excitability,qJjM8hkAAAAJ:t6usbXjVLHcC,33,https://scholar.google.com/scholar?oi=bibs&hl=en&cites=7486196922313642001,2014
111,Tim H. Murphy,Targeted ischemic stroke induction and mesoscopic imaging assessment of blood flow and ischemic depolarization in awake mice,qJjM8hkAAAAJ:ML0RJ9NH7IQC,31,https://scholar.google.com/scholar?oi=bibs&hl=en&cites=18440917958189671633,2017
112,Tim H. Murphy,Large scale cortical functional networks associated with slow-wave and spindle-burst-related spontaneous activity,qJjM8hkAAAAJ:evX43VCCuoAC,31,https://scholar.google.com/scholar?oi=bibs&hl=en&cites=9942922526230585752,2016
113,Tim H. Murphy,Longitudinal monitoring of mesoscopic cortical activity in a mouse model of microinfarcts reveals dissociations with behavioral and motor function,qJjM8hkAAAAJ:tYavs44e6CUC,30,https://scholar.google.com/scholar?oi=bibs&hl=en&cites=14907619011741590251,2019
114,Tim H. Murphy,Optogenetic analysis of neuronal excitability during global ischemia reveals selective deficits in sensory processing following reperfusion in mouse cortex,qJjM8hkAAAAJ:l7t_Zn2s7bgC,30,https://scholar.google.com/scholar?oi=bibs&hl=en&cites=13708989840715971276,2012
115,Tim H. Murphy,Real-time selective markerless tracking of forepaws of head fixed mice using deep neural networks,qJjM8hkAAAAJ:q3CdL3IzO_QC,29,https://scholar.google.com/scholar?oi=bibs&hl=en&cites=4518848989839955730,2020
116,Tim H. Murphy,Action-potential-independent GABAergic tone mediated by nicotinic stimulation of immature striatal miniature synaptic transmission,qJjM8hkAAAAJ:g5m5HwL7SMYC,29,https://scholar.google.com/scholar?oi=bibs&hl=en&cites=16847682503667054403,2007
117,Tim H. Murphy,"Proteins that promote filopodia stability, but not number, lead to more axonal-dendritic contacts",qJjM8hkAAAAJ:fPk4N6BV_jEC,28,https://scholar.google.com/scholar?oi=bibs&hl=en&cites=12384671162790502093,2011
118,Tim H. Murphy,Recent progress in translational research on neurovascular and neurodegenerative disorders,qJjM8hkAAAAJ:yB1At4FlUx8C,27,https://scholar.google.com/scholar?oi=bibs&hl=en&cites=12576715822187538366,2017
119,Tim H. Murphy,"Reduction of H2O2-evoked, intracellular calcium increases in the rat N18-RE-105 neuronal cell line by pretreatment with an electrophilic antioxidant inducer",qJjM8hkAAAAJ:hMod-77fHWUC,27,https://scholar.google.com/scholar?oi=bibs&hl=en&cites=7581799678130154042,1999
120,Tim H. Murphy,Gamma frequency activation of inhibitory neurons in the acute phase after stroke attenuates vascular and behavioral dysfunction,qJjM8hkAAAAJ:ClCfbGk0d_YC,25,https://scholar.google.com/scholar?oi=bibs&hl=en&cites=11444719035876430571,2021
121,Tim H. Murphy,Cost effective raspberry pi-based radio frequency identification tagging of mice suitable for automated in vivo imaging,qJjM8hkAAAAJ:tzM49s52ZIMC,24,https://scholar.google.com/scholar?oi=bibs&hl=en&cites=4732589209498320572,2017
122,Tim H. Murphy,Automated task training and longitudinal monitoring of mouse mesoscale cortical circuits using home cages,qJjM8hkAAAAJ:XoXfffV-tXoC,23,https://scholar.google.com/scholar?oi=bibs&hl=en&cites=17504367530433245228,2020
123,Tim H. Murphy,Automating mouse weighing in group homecages with Raspberry Pi micro-computers,qJjM8hkAAAAJ:uc_IGeMz5qoC,23,https://scholar.google.com/scholar?oi=bibs&hl=en&cites=3180580708965154711,2017
124,Tim H. Murphy,Motor maps and the cortical control of movement,qJjM8hkAAAAJ:1qzjygNMrQYC,23,https://scholar.google.com/scholar?oi=bibs&hl=en&cites=2725504279221241865,2014
125,Tim H. Murphy,Optical postsynaptic measurement of vesicle release rates for hippocampal synapses undergoing asynchronous release during train stimulation,qJjM8hkAAAAJ:blknAaTinKkC,23,https://scholar.google.com/scholar?oi=bibs&hl=en&cites=7424592746625032889,2004
126,Tim H. Murphy,Okadaic Acid Induces Hyperphosphorylation of τ Independently of Mitogen‐Activated Protein Kinase Activation,qJjM8hkAAAAJ:JV2RwH3_ST0C,23,https://scholar.google.com/scholar?oi=bibs&hl=en&cites=6518946785314063050,1997
127,Tim H. Murphy,MesoNet allows automated scaling and segmentation of mouse mesoscale cortical maps using machine learning,qJjM8hkAAAAJ:86PQX7AUzd4C,22,https://scholar.google.com/scholar?oi=bibs&hl=en&cites=1433412602669116123,2021
128,Tim H. Murphy,"Network analysis of mesoscale optical recordings to assess regional, functional connectivity",qJjM8hkAAAAJ:WqliGbK-hY8C,22,https://scholar.google.com/scholar?oi=bibs&hl=en&cites=6405332730086047599,2015
129,Tim H. Murphy,An automated home-cage system to assess learning and performance of a skilled motor task in a mouse model of Huntington’s disease,qJjM8hkAAAAJ:vbGhcppDl1QC,21,https://scholar.google.com/scholar?oi=bibs&hl=en&cites=5152068384861135693,2017
130,Tim H. Murphy,Individualized tracking of self-directed motor learning in group-housed mice performing a skilled lever positioning task in the home cage,qJjM8hkAAAAJ:EYYDruWGBe4C,20,https://scholar.google.com/scholar?oi=bibs&hl=en&cites=11214399055399433443,2018
131,Tim H. Murphy,Nrf2 gene deletion fails to alter psychostimulant-induced behavior or neurotoxicity,qJjM8hkAAAAJ:70eg2SAEIzsC,20,https://scholar.google.com/scholar?oi=bibs&hl=en&cites=4621980250995965858,2007
132,Tim H. Murphy,Automated touch sensing in the mouse tapered beam test using Raspberry Pi,qJjM8hkAAAAJ:p__nRnzSRKYC,19,https://scholar.google.com/scholar?oi=bibs&hl=en&cites=4474791827964661386,2017
133,Tim H. Murphy,Towards a circuit mechanism for movement tuning in motor cortex,qJjM8hkAAAAJ:08ZZubdj9fEC,19,https://scholar.google.com/scholar?oi=bibs&hl=en&cites=7291508910134118245,2013
134,Tim H. Murphy,Differential regulation of cell proliferation in neurogenic zones in mice lacking cystine transport by xCT,qJjM8hkAAAAJ:35N4QoGY0k4C,19,https://scholar.google.com/scholar?oi=bibs&hl=en&cites=7460021771828997165,2007
135,Tim H. Murphy,Activity-dependent synapse development: changing the rules,qJjM8hkAAAAJ:NaGl4SEjCO4C,19,https://scholar.google.com/scholar?oi=bibs&hl=en&cites=16798206851232185383,2003
136,Tim H. Murphy,Comparison between transgenic and AAV-PHP.eB-mediated expression of GCaMP6s using in vivo wide-field functional imaging of brain activity,qJjM8hkAAAAJ:M7yex6snE4oC,18,https://scholar.google.com/scholar?oi=bibs&hl=en&cites=2698981738658751939,2019
137,Tim H. Murphy,Automated and quantitative image analysis of ischemic dendritic blebbing using in vivo 2-photon microscopy data,qJjM8hkAAAAJ:ZHo1McVdvXMC,18,https://scholar.google.com/scholar?oi=bibs&hl=en&cites=1085229084106411742,2011
138,Tim H. Murphy,Phosphoinositide turnover associated with synaptic transmission,qJjM8hkAAAAJ:M3NEmzRMIkIC,18,https://scholar.google.com/scholar?oi=bibs&hl=en&cites=2419988994699558842,1992
139,Tim H. Murphy,Resistance of Optogenetically Evoked Motor Function to Global Ischemia and Reperfusion in Mouse in Vivo,qJjM8hkAAAAJ:D_sINldO8mEC,17,https://scholar.google.com/scholar?oi=bibs&hl=en&cites=3550931192695805745,2013
140,Tim H. Murphy,"Mesoscale brain explorer, a flexible python-based image analysis and visualization tool",qJjM8hkAAAAJ:EkHepimYqZsC,16,https://scholar.google.com/scholar?oi=bibs&hl=en&cites=2654529664063752384,2017
141,Tim H. Murphy,Two-Photon Imaging of Neuronal Structural Plasticity in Mice during and after Ischemia.,qJjM8hkAAAAJ:K3LRdlH-MEoC,15,https://scholar.google.com/scholar?oi=bibs&hl=en&cites=10923706230447477916,2015
142,Tim H. Murphy,The antioxidant enzyme quinone reductase is up-regulated in vivo following cerebral ischemia,qJjM8hkAAAAJ:YFjsv_pBGBYC,13,https://scholar.google.com/scholar?oi=bibs&hl=en&cites=13929816653210603866,2001
143,Tim H. Murphy,Amplification of calcium signals at dendritic spines provides a method for CNS quantal analysis,qJjM8hkAAAAJ:GnPB-g6toBAC,13,https://scholar.google.com/scholar?oi=bibs&hl=en&cites=8347083813977827662,1999
144,Tim H. Murphy,7. The non-excitatory mechanisms of glutamate induced neurotoxicity,qJjM8hkAAAAJ:lSLTfruPkqcC,13,https://scholar.google.com/scholar?oi=bibs&hl=en&cites=8223258234347613485,1991
145,Tim H. Murphy,Real-time markerless video tracking of body parts in mice using deep neural networks,qJjM8hkAAAAJ:LI9QrySNdTsC,12,https://scholar.google.com/scholar?oi=bibs&hl=en&cites=291819439416379317,2018
146,Tim H. Murphy,AMPA receptor-mediated miniature synaptic calcium transients in GluR2 null mice,qJjM8hkAAAAJ:vV6vV6tmYwMC,12,https://scholar.google.com/scholar?oi=bibs&hl=en&cites=6628942355244652310,2002
147,Tim H. Murphy,Incidental findings in neuroimaging research: a framework for anticipating the next frontier,qJjM8hkAAAAJ:dshw04ExmUIC,11,https://scholar.google.com/scholar?oi=bibs&hl=en&cites=9464429936915941254,2012
148,Tim H. Murphy,Competitive Inhibition of NMDA Receptor–Mediated Currents by Extracellular Calcium Chelators,qJjM8hkAAAAJ:BqipwSGYUEgC,11,https://scholar.google.com/scholar?oi=bibs&hl=en&cites=5690198857790813329,2000
149,Tim H. Murphy,Stress impacts sensory variability through cortical sensory activity motifs,qJjM8hkAAAAJ:foquWX3nUaYC,10,https://scholar.google.com/scholar?oi=bibs&hl=en&cites=5057668178905684896,2020
150,Tim H. Murphy,Executive dysfunction and blockage of brain microvessels in a rat model of vascular cognitive impairment,qJjM8hkAAAAJ:ILKRHgRFtOwC,10,https://scholar.google.com/scholar?oi=bibs&hl=en&cites=17284492283171730793,2018
151,Tim H. Murphy,Vesicle number does not predict postsynaptic measures of miniature synaptic activity frequency in cultured cortical neurons,qJjM8hkAAAAJ:ldfaerwXgEUC,10,https://scholar.google.com/scholar?oi=bibs&hl=en&cites=7186847572395978002,2000
152,Tim H. Murphy,Ubiquinone (coenzyme Q10) and complex I in mitochondrial oxidative disorder of Parkinson's disease,qJjM8hkAAAAJ:dfsIfKJdRG4C,10,https://scholar.google.com/scholar?oi=bibs&hl=en&cites=5233806233992664847,2000
153,Tim H. Murphy,The University of British Columbia,qJjM8hkAAAAJ:_axFR9aDTf0C,9,https://scholar.google.com/scholar?oi=bibs&hl=en&cites=8392359270308660910,1974
154,Tim H. Murphy,Removing the brakes on post-stroke plasticity drives recovery from the intact hemisphere and spinal cord,qJjM8hkAAAAJ:HE397vMXCloC,8,https://scholar.google.com/scholar?oi=bibs&hl=en&cites=10826430363090587963,2014
155,Tim H. Murphy,Dendritic spines and pre-synaptic boutons are stable despite local deep hypothermic challenge and re-warming in vivo,qJjM8hkAAAAJ:OU6Ihb5iCvQC,8,https://scholar.google.com/scholar?oi=bibs&hl=en&cites=13578861168709029870,2012
156,Tim H. Murphy,Moderate or deep local hypothermia does not prevent the onset of ischemia-induced dendritic damage,qJjM8hkAAAAJ:UxriW0iASnsC,8,https://scholar.google.com/scholar?oi=bibs&hl=en&cites=7017708434601997437,2012
157,Tim H. Murphy,Effective release rates at single rat Schaffer collateral–CA1 synapses during sustained theta‐burst activity revealed by optical imaging,qJjM8hkAAAAJ:M05iB0D1s5AC,8,https://scholar.google.com/scholar?oi=bibs&hl=en&cites=12222733100447701594,2007
158,Tim H. Murphy,Ca2+-independent spine dynamics in cultured hippocampal neurons,qJjM8hkAAAAJ:SeFeTyx0c_EC,8,https://scholar.google.com/scholar?oi=bibs&hl=en&cites=17035576455095037189,2004
159,Tim H. Murphy,Mesoscale cortex-wide neural dynamics predict self-initiated actions in mice several seconds prior to movement,qJjM8hkAAAAJ:YohjEiUPhakC,7,https://scholar.google.com/scholar?oi=bibs&hl=en&cites=9980277512901561014,2022
160,Tim H. Murphy,Altered cortical processing of sensory input in Huntington disease mouse models,qJjM8hkAAAAJ:PVjk1bu6vJQC,6,https://scholar.google.com/scholar?oi=bibs&hl=en&cites=4170540167486453253,2022
161,Tim H. Murphy,A visual guide to sorting electrophysiological recordings using'SpikeSorter',qJjM8hkAAAAJ:j8SEvjWlNXcC,6,https://scholar.google.com/scholar?oi=bibs&hl=en&cites=8888830671165109968,2017
162,Tim H. Murphy,Dicarboxylic amino acids block epileptiform activity in hippocampal slice,qJjM8hkAAAAJ:HoB7MX3m0LUC,6,https://scholar.google.com/scholar?oi=bibs&hl=en&cites=3602837625818794280,1986
163,Tim H. Murphy,PiDose: an open-source system for accurate and automated oral drug administration to group-housed mice,qJjM8hkAAAAJ:Ug5p-4gJ2f0C,5,https://scholar.google.com/scholar?oi=bibs&hl=en&cites=11638724416323525238,2020
164,Tim H. Murphy,Mind-altering miniature neurotransmitter release?,qJjM8hkAAAAJ:zA6iFVUQeVQC,5,https://scholar.google.com/scholar?oi=bibs&hl=en&cites=6792722649992879795,2003
165,Tim H. Murphy,Mesoscale cortical calcium imaging reveals widespread synchronized infraslow activity during social touch in mice,qJjM8hkAAAAJ:lmc2jWPfTJgC,4,"https://scholar.google.com/scholar?oi=bibs&hl=en&cites=13101229287856874837,12412178518097438954",2018
166,Tim H. Murphy,Spontaneous activity synchronizes whisker-related sensorimotor networks prior to their maturation in the developing rat cortex,qJjM8hkAAAAJ:BwyfMAYsbu0C,4,https://scholar.google.com/scholar?oi=bibs&hl=en&cites=10971214032075017349,2017
167,Tim H. Murphy,RENAL ALPHA-RECEPTORS IN EXPERIMENTAL-HYPERTENSION IN THE RAT,qJjM8hkAAAAJ:_B80troHkn4C,4,https://scholar.google.com/scholar?oi=bibs&hl=en&cites=1231197213288956124,1980
168,Tim H. Murphy,Study protocol for Attachment & Child Health (ATTACHTM) program: promoting vulnerable Children’s health at scale,qJjM8hkAAAAJ:XvxMoLDsR5gC,3,https://scholar.google.com/scholar?oi=bibs&hl=en&cites=7175854848259860017,2022
169,Tim H. Murphy,Peripheral nerve ligation elicits widespread alterations in cortical sensory evoked and spontaneous activity,qJjM8hkAAAAJ:PoWvk5oyLR8C,3,https://scholar.google.com/scholar?oi=bibs&hl=en&cites=18082833727000992366,2019
170,Tim H. Murphy,PyRodentTracks: flexible computer vision and RFID based system for multiple rodent tracking and behavioral assessment,qJjM8hkAAAAJ:bz8QjSJIRt4C,2,https://scholar.google.com/scholar?oi=bibs&hl=en&cites=13357518097814038119,2022
171,Tim H. Murphy,Uncovering the effect of different brain regions on behavioral classification using recurrent neural networks,qJjM8hkAAAAJ:rmuvC79q63oC,2,https://scholar.google.com/scholar?oi=bibs&hl=en&cites=18401694308670013641,2021
172,Tim H. Murphy,Good vibrations: resting-state functional connectivity reflects entrainment of vasomotion,qJjM8hkAAAAJ:hMsQuOkrut0C,2,https://scholar.google.com/scholar?oi=bibs&hl=en&cites=6226891791225216745,2017
173,Tim H. Murphy,"Optogenetic mapping after stroke reveals network-wide scaling of functional connections and heterogeneous recovery of the peri-infarct (December, pg 16455, 2014)",qJjM8hkAAAAJ:N5tVd3kTz84C,2,https://scholar.google.com/scholar?oi=bibs&hl=en&cites=17896152486409908605,2015
174,Tim H. Murphy,Neurophotonics tutorial on making connectivity diagrams from Channelrhodopsin-2 stimulated data,qJjM8hkAAAAJ:e_rmSamDkqQC,2,https://scholar.google.com/scholar?oi=bibs&hl=en&cites=4427386120640554880,2015
175,Tim H. Murphy,Water-Reaching Platform for Longitudinal Assessment of Cortical Activity and Fine Motor Coordination Defects in a Huntington Disease Mouse Model,qJjM8hkAAAAJ:anf4URPfarAC,1,https://scholar.google.com/scholar?oi=bibs&hl=en&cites=10545216951026490170,2023
176,Tim H. Murphy,"Towards a Visualizable, De-identified Synthetic Biomarker of Human Movement Disorders",qJjM8hkAAAAJ:_FM0Bhl9EiAC,1,https://scholar.google.com/scholar?oi=bibs&hl=en&cites=15280450351694723196,2022
177,Tim H. Murphy,Group-Patch Based Classification and Asymptotic Predicting Imbalanced Neuron Spikes,qJjM8hkAAAAJ:edDO8Oi4QzsC,1,https://scholar.google.com/scholar?oi=bibs&hl=en&cites=10626395934348014509,2020
178,Tim H. Murphy,Cortex-wide Computations in Complex Decision Making in Mice,qJjM8hkAAAAJ:xtoqd-5pKcoC,1,https://scholar.google.com/scholar?oi=bibs&hl=en&cites=4606384251620486540,2019
179,Tim H. Murphy,"LFP clustering in cortex reveals a taxonomy of Up states and near-millisecond, ordered phase-locking in cortical neurons",qJjM8hkAAAAJ:i2xiXl-TujoC,1,https://scholar.google.com/scholar?oi=bibs&hl=en&cites=12336986677107275782,2019
180,Tim H. Murphy,Monitoring the functional parcellation and topography with mesoscopic calcium imaging of resting state cortical activitity in mice,qJjM8hkAAAAJ:9Nmd_mFXekcC,1,https://scholar.google.com/scholar?oi=bibs&hl=en&cites=2169288075280199466,2016
181,Tim H. Murphy,Restriction of peroxidase-mediated antibody reactivity to single neurons by local hydrogen peroxide production,qJjM8hkAAAAJ:u_35RYKgDlwC,1,https://scholar.google.com/scholar?oi=bibs&hl=en&cites=7964883609311660774,1999
182,Tim H. Murphy,An electrophysiological examination of intentional and inadvertent sleep onset: the effect of intention on the sleep onset process,qJjM8hkAAAAJ:SpbeaW3--B0C,1,https://scholar.google.com/scholar?oi=bibs&hl=en&cites=11887812445443732493,1995
183,Tim H. Murphy,PyMouseTracks: Flexible Computer Vision and RFID-Based System for Multiple Mouse Tracking and Behavioral Assessment,qJjM8hkAAAAJ:sNmaIFBj_lkC,0,,2023
184,Tim H. Murphy,Behavioral Classification of Sequential Neural Activity Using Time Varying Recurrent Neural Networks,qJjM8hkAAAAJ:6ZxmRoH8BuwC,0,,2023
185,Tim H. Murphy,Leveraging the power of 3D brain-wide imaging and mapping tools for brain injury research in murine models,qJjM8hkAAAAJ:DUooU5lO8OsC,0,,2023
186,Tim H. Murphy,Decoding State-Dependent Cortical-Cerebellar Cellular Functional Connectivity in the Mouse Brain,qJjM8hkAAAAJ:umqufdRvDiIC,0,,2023
187,Tim H. Murphy,Mesotrode: chronic simultaneous mesoscale cortical imaging and subcortical or peripheral nerve spiking activity recording in mice.,qJjM8hkAAAAJ:4hFrxpcac9AC,0,,2023
188,Tim H. Murphy,Chronic multiscale resolution of mouse brain networks using combined mesoscale cortical imaging and subcortical fiber photometry,qJjM8hkAAAAJ:NXb4pA-qfm4C,0,,2023
189,Tim H. Murphy,Multiscale imaging informs translational mouse modeling of neurological disease,qJjM8hkAAAAJ:8d8msizDQcsC,0,,2022
190,Tim H. Murphy,Longitudinal assessment of water-reaching reveals altered cortical activity and fine motor coordination defects in a Huntington Disease model,qJjM8hkAAAAJ:FAceZFleit8C,0,,2022
191,Tim H. Murphy,Scholar Metrics Scraper (SMS): automated retrieval of citation and author data,qJjM8hkAAAAJ:Ri6SYOTghG4C,0,,2021
192,Tim H. Murphy,Activity dependent neuroprotection in the acute phase after stroke,qJjM8hkAAAAJ:S16KYo8Pm5AC,0,,2019
193,Tim H. Murphy,"High-Throughput Electrophysiological, Behavioral, or Social Event Triggered Imaging of Mouse Mesoscale Brain Activity",qJjM8hkAAAAJ:kz9GbA2Ns4gC,0,,2019
194,Tim H. Murphy,Stereotyped large amplitude cortical LFP events can be clustered and reveal precisely ordered phase-locking in neuronal populations,qJjM8hkAAAAJ:VaXvl8Fpj5cC,0,,2019
195,Tim H. Murphy,Executive dysfunction and altered cerebrovascular activity in a rodent model of vascular cognitive impairment,qJjM8hkAAAAJ:TIZ-Mc8IlK0C,0,,2018
196,Tim H. Murphy,Longitudinal monitoring of mesoscopic cortical activity using a fluorescent bead mouse model of small vessel disease and GCaMP6 imaging,qJjM8hkAAAAJ:zLWjf1WUPmwC,0,,2017
197,Tim H. Murphy,Mesoscale cortical mapping reveals region-specific and frequency-dependent changes in a mouse model of electroconvulsive therapy,qJjM8hkAAAAJ:fEOibwPWpKIC,0,,2017
198,Tim H. Murphy,REVERSIBLE INACTIVATION MAPPING OF CORTICAL SITES REQUIRED FOR VOLUNTARY FORELIMB MOVEMENTS IN VGAT-CHR2 TRANSGENIC MICE.,qJjM8hkAAAAJ:0KyAp5RtaNEC,0,,2016
199,Tim H. Murphy,"IN VIVO, MESOSCALE VOLTAGE IMAGING OF CORTICAL DYNAMICS AS A PLATFORM FOR INVESTIGATING MOUSE MODELS OF NEURODEGENERATIVE AND PSYCHIATRIC DISEASE",qJjM8hkAAAAJ:XD-gHx7UXLsC,0,,2016
200,Tim H. Murphy,RAPID MESOSCALE TRANSCRANIAL CORTICAL IMAGING WITH GENETIC-ENCODED GLUTAMATE SENSOR-IGLUSNFR,qJjM8hkAAAAJ:t7zJ5fGR-2UC,0,,2016
201,Tim H. Murphy,CONCURRENT ASSESSMENT OF FORELIMB FUNCTION AND MESOSCOPIC CORTICAL NETWORKS IN MOUSE STROKE MODELS,qJjM8hkAAAAJ:VLnqNzywnoUC,0,,2016
202,Tim H. Murphy,"Special Section on Light Microscopy of Connectivity: Network analysis of mesoscale optical recordings to assess regional, functional connectivity",qJjM8hkAAAAJ:Fu2w8maKXqMC,0,,2015
203,Tim H. Murphy,Special Section Guest Editorial: Special Section on Light Microscopy of Connectivity,qJjM8hkAAAAJ:ZuybSZzF8UAC,0,,2015
204,Tim H. Murphy,Point-source Maps: Relations between Mesoscopic Imaging of Mouse Cortex and Neuronal Spiking,qJjM8hkAAAAJ:nrtMV_XWKgEC,0,,2015
205,Tim H. Murphy,Cortical activity motifs that correspond to sensory modalities are organized within larger super-clusters,qJjM8hkAAAAJ:_Ybze24A_UAC,0,,2015
206,Tim H. Murphy,Development of a Mouse Model of Diffuse Microinfarction and Automated Assessment Tools for Monitoring Recovery,qJjM8hkAAAAJ:JoZmwDi-zQgC,0,,2014
207,Tim H. Murphy,A dynamic model for delta rhythm fit to high-frequency cortical activity data shows discrete functional connectivity in mouse cortex,qJjM8hkAAAAJ:Mojj43d5GZwC,0,,2014
208,Tim H. Murphy,In Vivo Channelrhodopsin-2 Stimulation and Voltage-Sensitive Dye Imaging in a Mouse Model of Stroke Reveals Preserved Functional Connections Posterior to the Lesion,qJjM8hkAAAAJ:olpn-zPbct0C,0,,2013
209,Tim H. Murphy,"Improved Methods for Longitudinal Motor Mapping After Stroke in Mice: Automated Movement Tracking with Accelerometers, and Chronic EEG Recording in a Bilateral Cranial Window …",qJjM8hkAAAAJ:XiVPGOgt02cC,0,,2013
210,Tim H. Murphy,Optogenetic Analysis of Function and Structure of Parvalbumin Neurons Following Transient Global Ischemia in Mice,qJjM8hkAAAAJ:bnK-pcrLprsC,0,,2013
211,Tim H. Murphy,Optogenetic activation of mouse cortical inhibitory interneurons is sufficient to increase local blood flow,qJjM8hkAAAAJ:5ugPr518TE4C,0,,2013
212,Tim H. Murphy,Voltage Sensitive Dyes in Combination with Optogenetics: Tools for Imaging Cortical Circuit Function Following Stroke in Mouse,qJjM8hkAAAAJ:mvPsJ3kp5DgC,0,,2013
213,Tim H. Murphy,A model for delta rhythm fit to high-frequency cortical activity data,qJjM8hkAAAAJ:q3oQSFYPqjQC,0,,2013
214,Tim H. Murphy,Longitudinal mapping of sensorimotor cortex after targeted stroke in mice,qJjM8hkAAAAJ:8AbLer7MMksC,0,,2012
215,Tim H. Murphy,www. csueastbay. edu/JERHRE,qJjM8hkAAAAJ:tKAzc9rXhukC,0,,2012
216,Tim H. Murphy,Light-based mapping of sensorimotor cortical reorganization after stroke,qJjM8hkAAAAJ:5Ul4iDaHHb8C,0,,2011
217,Tim H. Murphy,"FUNCTIONAL SCREEN FOR SYNAPTIC ORGANIZERS: IDENTIFICATION OF TRKC-PTP sigma AND SLITRK, CANDIDATE GENES IN NEUROPSYCHIATRIC DISORDERS",qJjM8hkAAAAJ:35r97b3x0nAC,0,,2011
218,Tim H. Murphy,Slow cortical oscillations and limb twitches in the neonatal rat.,qJjM8hkAAAAJ:z_wVstp3MssC,0,,2011
219,Tim H. Murphy,Glial laminar cortical architecture matches metabolic demand,qJjM8hkAAAAJ:1sJd4Hv_s6UC,0,,2011
220,Tim H. Murphy,Mechanisms of altered N-methyl-D-aspartate receptor-mediated calcium signaling in the YAC mouse model of Huntington's disease,qJjM8hkAAAAJ:geHnlv5EZngC,0,,2008
221,Tim H. Murphy,Stroking the Synapse: Insight into Ischemic Damage and Recovery from in vivo 2-Photon Imaging of Individual Synapses,qJjM8hkAAAAJ:f2IySw72cVMC,0,,2006
222,Tim H. Murphy,Selective reduction of weak synaptic activity awakens dormant synapses,qJjM8hkAAAAJ:cFHS6HbyZ2cC,0,,2004
223,Tim H. Murphy,Differential regulation of synaptic and extrasynaptic NMDA receptors,qJjM8hkAAAAJ:sSrBHYA8nusC,0,,2003
224,Tim H. Murphy,Development/Plasticity/Repair-Modular Transport of Postsynaptic Density-95 Clusters and Association with Stable Spine Precursors during Early Development of Cortical Neurons,qJjM8hkAAAAJ:vDijr-p_gm4C,0,,2001
225,Tim H. Murphy,PS-61-7 Slow EEG as a predictor of an occurrence of sleep onset REM period in normal sleepers,qJjM8hkAAAAJ:kuK5TVdYjLIC,0,,1995
226,Tim H. Murphy,Deciphering the role of novel kinase cascades in neuronal signalling,qJjM8hkAAAAJ:_xSYboBqXhAC,0,,1995
227,Tim H. Murphy,Slow EEG as a predictor of an occurrence of sleep onset REM period in normal sleepers,qJjM8hkAAAAJ:gsN89kCJA0AC,0,,1995
228,Tim H. Murphy,SYNCHRONOUS INTRACELLULAR CALCIUM TRANSIENTS PRODUCED BY SYNAPTIC ACTIVITY IN CULTURED CORTICAL-NEURONS,qJjM8hkAAAAJ:LPZeul_q3PIC,0,,1992
229,Tim H. Murphy,Glutamate toxicity in a neuronal cell line involves inhibition of cystine uptake leading to oxidative stress,qJjM8hkAAAAJ:xtRiw3GOFMkC,0,,1989
230,Tim H. Murphy,EXCITOTOXINS-FROM RECEPTOR TO DISEASE,qJjM8hkAAAAJ:J-pR_7NvFogC,0,,1988
231,Tim H. Murphy,MesoGAN: behavior generation from neural decoding of mesoscale cortical calcium dynamics using Generative Adversarial Networks.,qJjM8hkAAAAJ:_5tno0g5mFcC,0,,
232,Tim H. Murphy,Mesoscale cortex-wide neural dynamics predict self-initiated actions in mice several seconds prior to movement,qJjM8hkAAAAJ:a9-T7VOCCH8C,0,,
233,Tim H. Murphy,"LFP clustering in cortex reveals a taxonomy of UP-states and near-2 millisecond, ordered phase-locking in cortical neurons 3",qJjM8hkAAAAJ:4fGpz3EwCPoC,0,,
234,Tim H. Murphy,Real-time forepaw movement coded auditory feedback promotes motor skill learning in mice.,qJjM8hkAAAAJ:0N-VGjzr574C,0,,
235,Tim H. Murphy,BlebQuant: A MATLAB-based program for dendritic blebbing analysis,qJjM8hkAAAAJ:2KloaMYe4IUC,0,,
236,Tim H. Murphy,Molecules that Enhance Axonal Sprouting and Recovery after Stroke,qJjM8hkAAAAJ:_Re3VWB3Y0AC,0,,
237,Tim H. Murphy,by Dendritic Calcium Imaging,qJjM8hkAAAAJ:eq2jaN3J8jMC,0,,
238,Tim H. Murphy,Phosphoinositide-Linked Glutamate Receptors: Prominent Actions in Neurons and Glia,qJjM8hkAAAAJ:wbdj-CoPYUoC,0,,
